{
  "$schema": "../../../shared/schemas/skeleton.schema.json",
  "version": "1.0.0",
  "id": "11111111-aaaa-4b3c-8d2e-000000000001",
  "name": "HeroRig",
  "source": "Content/Characters/hero.fbx",
  "bones": [
    {
      "index": 0,
      "name": "root",
      "parentIndex": -1,
      "bindPose": {
        "translation": [
          0.0,
          0.0,
          0.0
        ],
        "rotation": [
          0.0,
          0.0,
          0.0,
          1.0
        ],
        "scale": [
          1.0,
          1.0,
          1.0
        ]
      }
    },
    {
      "index": 1,
      "name": "pelvis",
      "parentIndex": 0,
      "bindPose": {
        "translation": [
          0.0,
          0.98,
          0.0
        ],
        "rotation": [
          0.0,
          0.0,
          0.0,
          1.0
        ],
        "scale": [
          1.0,
          1.0,
          1.0
        ]
      }
    },
    {
      "index": 2,
      "name": "spine_01",
      "parentIndex": 1,
      "bindPose": {
        "translation": [
          0.0,
          0.12,
          0.0
        ],
        "rotation": [
          0.0,
          0.0,
          0.0,
          1.0
        ],
        "scale": [
          1.0,
          1.0,
          1.0
        ]
      }
    },
    {
      "index": 3,
      "name": "spine_02",
      "parentIndex": 2,
      "bindPose": {
        "translation": [
          0.0,
          0.12,
          0.0
        ],
        "rotation": [
          0.0,
          0.0,
          0.0,
          1.0
        ],
        "scale": [
          1.0,
          1.0,
          1.0
        ]
      }
    },
    {
      "index": 4,
      "name": "spine_03",
      "parentIndex": 3,
      "bindPose": {
        "translation": [
          0.0,
          0.12,
          0.0
        ],
        "rotation": [
          0.0,
          0.0,
          0.0,
          1.0
        ],
        "scale": [
          1.0,
          1.0,
          1.0
        ]
      }
    },
    {
      "index": 5,
      "name": "neck",
      "parentIndex": 4,
      "bindPose": {
        "translation": [
          0.0,
          0.12,
          0.0
        ],
        "rotation": [
          0.0,
          0.0,
          0.0,
          1.0
        ],
        "scale": [
          1.0,
          1.0,
          1.0
        ]
      }
    },
    {
      "index": 6,
      "name": "head",
      "parentIndex": 5,
      "bindPose": {
        "translation": [
          0.0,
          0.12,
          0.0
        ],
        "rotation": [
          0.0,
          0.0,
          0.0,
          1.0
        ],
        "scale": [
          1.0,
          1.0,
          1.0
        ]
      }
    },
    {
      "index": 7,
      "name": "L_clavicle",
      "parentIndex": 4,
      "bindPose": {
        "translation": [
          0.12,
          0.08,
          0.0
        ],
        "rotation": [
          0.0,
          0.0,
          0.0,
          1.0
        ],
        "scale": [
          1.0,
          1.0,
          1.0
        ]
      }
    },
    {
      "index": 8,
      "name": "L_upper_arm",
      "parentIndex": 7,
      "bindPose": {
        "translation": [
          0.22,
          0.0,
          0.0
        ],
        "rotation": [
          0.0,
          0.0,
          -0.05,
          0.998
        ],
        "scale": [
          1.0,
          1.0,
          1.0
        ]
      }
    },
    {
      "index": 9,
      "name": "L_lower_arm",
      "parentIndex": 8,
      "bindPose": {
        "translation": [
          0.25,
          0.0,
          0.0
        ],
        "rotation": [
          0.0,
          0.0,
          0.0,
          1.0
        ],
        "scale": [
          1.0,
          1.0,
          1.0
        ]
      }
    },
    {
      "index": 10,
      "name": "L_hand",
      "parentIndex": 9,
      "bindPose": {
        "translation": [
          0.22,
          0.0,
          0.0
        ],
        "rotation": [
          0.0,
          0.0,
          0.0,
          1.0
        ],
        "scale": [
          1.0,
          1.0,
          1.0
        ]
      }
    },
    {
      "index": 11,
      "name": "R_clavicle",
      "parentIndex": 4,
      "bindPose": {
        "translation": [
          -0.12,
          0.08,
          0.0
        ],
        "rotation": [
          0.0,
          0.0,
          0.0,
          1.0
        ],
        "scale": [
          1.0,
          1.0,
          1.0
        ]
      }
    },
    {
      "index": 12,
      "name": "R_upper_arm",
      "parentIndex": 11,
      "bindPose": {
        "translation": [
          -0.22,
          0.0,
          0.0
        ],
        "rotation": [
          0.0,
          0.0,
          0.05,
          0.998
        ],
        "scale": [
          1.0,
          1.0,
          1.0
        ]
      }
    },
    {
      "index": 13,
      "name": "R_lower_arm",
      "parentIndex": 12,
      "bindPose": {
        "translation": [
          -0.25,
          0.0,
          0.0
        ],
        "rotation": [
          0.0,
          0.0,
          0.0,
          1.0
        ],
        "scale": [
          1.0,
          1.0,
          1.0
        ]
      }
    },
    {
      "index": 14,
      "name": "R_hand",
      "parentIndex": 13,
      "bindPose": {
        "translation": [
          -0.22,
          0.0,
          0.0
        ],
        "rotation": [
          0.0,
          0.0,
          0.0,
          1.0
        ],
        "scale": [
          1.0,
          1.0,
          1.0
        ]
      }
    },
    {
      "index": 15,
      "name": "L_upper_leg",
      "parentIndex": 1,
      "bindPose": {
        "translation": [
          0.1,
          -0.04,
          0.0
        ],
        "rotation": [
          0.0,
          0.0,
          0.0,
          1.0
        ],
        "scale": [
          1.0,
          1.0,
          1.0
        ]
      }
    },
    {
      "index": 16,
      "name": "L_lower_leg",
      "parentIndex": 15,
      "bindPose": {
        "translation": [
          0.0,
          -0.42,
          0.0
        ],
        "rotation": [
          0.0,
          0.0,
          0.0,
          1.0
        ],
        "scale": [
          1.0,
          1.0,
          1.0
        ]
      }
    },
    {
      "index": 17,
      "name": "L_foot",
      "parentIndex": 16,
      "bindPose": {
        "translation": [
          0.0,
          -0.4,
          0.02
        ],
        "rotation": [
          0.0,
          0.0,
          0.0,
          1.0
        ],
        "scale": [
          1.0,
          1.0,
          1.0
        ]
      }
    },
    {
      "index": 18,
      "name": "R_upper_leg",
      "parentIndex": 1,
      "bindPose": {
        "translation": [
          -0.1,
          -0.04,
          0.0
        ],
        "rotation": [
          0.0,
          0.0,
          0.0,
          1.0
        ],
        "scale": [
          1.0,
          1.0,
          1.0
        ]
      }
    },
    {
      "index": 19,
      "name": "R_lower_leg",
      "parentIndex": 18,
      "bindPose": {
        "translation": [
          0.0,
          -0.42,
          0.0
        ],
        "rotation": [
          0.0,
          0.0,
          0.0,
          1.0
        ],
        "scale": [
          1.0,
          1.0,
          1.0
        ]
      }
    },
    {
      "index": 20,
      "name": "R_foot",
      "parentIndex": 19,
      "bindPose": {
        "translation": [
          0.0,
          -0.4,
          0.02
        ],
        "rotation": [
          0.0,
          0.0,
          0.0,
          1.0
        ],
        "scale": [
          1.0,
          1.0,
          1.0
        ]
      }
    }
  ]
}