{
  "$schema": "../../../shared/schemas/skeleton.schema.json",
  "version": "1.0.0",
  "id": "b5bb58f8-8e51-475a-9585-41fd02104e5b",
  "name": "GoblinRig",
  "source": "Content/Characters/goblin.fbx",
  "bones": [
    {
      "index": 0,
      "name": "root",
      "parentIndex": -1,
      "bindPose": {
        "translation": [
          0,
          0,
          0
        ],
        "rotation": [
          0,
          0,
          0,
          1
        ],
        "scale": [
          1,
          1,
          1
        ]
      }
    },
    {
      "index": 1,
      "name": "pelvis",
      "parentIndex": 0,
      "bindPose": {
        "translation": [
          0,
          0.9,
          0
        ],
        "rotation": [
          0,
          0,
          0,
          1
        ],
        "scale": [
          1,
          1,
          1
        ]
      }
    },
    {
      "index": 2,
      "name": "spine",
      "parentIndex": 1,
      "bindPose": {
        "translation": [
          0,
          0.18,
          0
        ],
        "rotation": [
          0,
          0,
          0,
          1
        ],
        "scale": [
          1,
          1,
          1
        ]
      }
    },
    {
      "index": 3,
      "name": "neck",
      "parentIndex": 2,
      "bindPose": {
        "translation": [
          0,
          0.16,
          0
        ],
        "rotation": [
          0,
          0,
          0,
          1
        ],
        "scale": [
          1,
          1,
          1
        ]
      }
    },
    {
      "index": 4,
      "name": "head",
      "parentIndex": 3,
      "bindPose": {
        "translation": [
          0,
          0.15,
          0
        ],
        "rotation": [
          0,
          0,
          0,
          1
        ],
        "scale": [
          1,
          1,
          1
        ]
      }
    },
    {
      "index": 5,
      "name": "L_arm",
      "parentIndex": 2,
      "bindPose": {
        "translation": [
          0.18,
          0.12,
          0
        ],
        "rotation": [
          0,
          0,
          0,
          1
        ],
        "scale": [
          1,
          1,
          1
        ]
      }
    },
    {
      "index": 6,
      "name": "R_arm",
      "parentIndex": 2,
      "bindPose": {
        "translation": [
          -0.18,
          0.12,
          0
        ],
        "rotation": [
          0,
          0,
          0,
          1
        ],
        "scale": [
          1,
          1,
          1
        ]
      }
    },
    {
      "index": 7,
      "name": "L_leg",
      "parentIndex": 1,
      "bindPose": {
        "translation": [
          0.1,
          -0.05,
          0
        ],
        "rotation": [
          0,
          0,
          0,
          1
        ],
        "scale": [
          1,
          1,
          1
        ]
      }
    },
    {
      "index": 8,
      "name": "R_leg",
      "parentIndex": 1,
      "bindPose": {
        "translation": [
          -0.1,
          -0.05,
          0
        ],
        "rotation": [
          0,
          0,
          0,
          1
        ],
        "scale": [
          1,
          1,
          1
        ]
      }
    }
  ]
}